{
	"$schema": "http://json-schema.org/draft-07/schema#",

	"definitions": {
		"action": {
			"type": "object",
			"properties": {
				"type": {"enum": ["stat_block_section"]},
				"subtype": {"enum": ["action"]},
				"name": {"enum": [
					"Reaction", "Free Action", "One Action",
					"Two Actions", "Three Actions", "One to Three Actions",
					"One or Two Actions", "Two or Three Actions"
				]}
			},
			"required": ["name", "type", "subtype"],
			"additionalProperties": false
		},
		"license": {
			"type": "object",
			"properties": {
				"name": {"type": "string"},
				"type": {"enum": ["section"]},
				"subtype": {"enum": ["license"]},
				"license": {"enum": ["OPEN GAME LICENSE Version 1.0a"]},
				"text": {"type": "string"},
				"sections": {"$ref": "#/definitions/sections"}
			},
			"additionalProperties": false
		},
		"link": {
			"type": "object",
			"properties": {
				"name": {"type": "string"},
				"type": {"enum": ["link"]},
				"alt": {"type": "string"},
				"href": {"type": "string"},
				"game-obj": {"enum": [
					"MonsterAbilities", "Sources", "Conditions", "Traits",
					"Rules", "Actions", "Skills", "Spells", "Rituals"
				]},
				"aonid": {"type": "integer"}
			},
			"required": ["name", "type", "alt"],
			"additionalProperties": false
		},
		"section": {
			"type": "object",
			"properties": {
				"name": {"type": "string"},
				"type": {"enum": ["section"]},
				"text": {"type": "string"},
				"sections": {"$ref": "#/definitions/sections"},
				"sources": {"$ref": "#/definitions/sources"},
				"subtype": {"enum": ["sidebar", "index"]},
				"sidebar_type": {"enum": [
					"treasure_and_rewards", "related_creatures", "locations",
					"additional_lore", "advice_and_rules"
				]},
				"sidebar_heading": {"type": "string"},
				"image": {"$ref": "#/definitions/image"}
			},
			"additionalProperties": false
		},
		"sections": {
			"type": "array",
			"items": {"$ref": "#/definitions/section"},
			"additionalItems": false
		},
		"source": {
			"type": "object",
			"properties": {
				"name": {"type": "string"},
				"type": {"enum": ["source"]},
				"link": {"$ref": "#/definitions/link"},
				"page": {"type": "integer"},
				"errata": {"$ref": "#/definitions/link"},
				"note": {"$ref": "#/definitions/link"}
			},
			"required": ["name", "type", "link"],
			"additionalProperties": false
		},
		"sources": {
			"type": "array",
			"items": {"$ref": "#/definitions/source"},
			"additionalItems": false
		},
		"abstract_trait": {
			"type": "object",
			"properties": {
				"name": {"type": "string"},
				"type": {"enum": ["trait", "trait_template"]},
				"text": {"type": "string"}
			},
			"required": ["name", "type"],
			"dependencies": {
				"game-id": {"$ref": "#/definitions/trait"}
			}
		},
		"trait": {
			"type": "object",
			"properties": {
				"name": {"type": "string"},
				"type": {"enum": ["trait"]},
				"game-id": {"type": "string"},
				"game-obj": {"enum": ["Traits"]},
				"value": {"type": "string"},
				"text": {"type": "string"},
				"classes": {
					"type": "array",
					"items": {"type": "string"},
					"additionalItems": false
				},
				"sources": {"$ref": "#/definitions/sources"},
				"links": {
					"type": "array",
					"items": {"$ref": "#/definitions/link"},
					"additionalItems": false
				}
			},
			"required": ["name", "type", "text", "game-id", "game-obj", "sources"],
			"additionalProperties": false
		},
		"traits": {
			"type": "array",
			"items": {"$ref": "#/definitions/abstract_trait"},
			"additionalItems": false
		},
		"trait_template": {
			"type": "object",
			"properties": {
				"name": {"type": "string"},
				"type": {"enum": ["trait_template"]},
				"text": {"type": "string"}
			},
			"required": ["name", "type", "text"],
			"additionalProperties": false
		}
	},
	"type": "object",
	"properties": {
		"name": {"type": "string"},
		"type": {"enum": ["ability"]},
		"ability_type": {"enum": ["universal_monster_ability"]},
		"game-id": {"type": "string"},
		"game-obj": {"enum": ["MonsterAbilities"]},
		"aonid": {"type": "integer"},
		"value": {"type": "string"},
		"action": {"$ref": "#/definitions/action"},
		"text": {"type": "string"},
		"effect": {"type": "string"},
		"requirement": {"type": "string"},
		"trigger": {"type": "string"},
		"failure": {"type": "string"},
		"success": {"type": "string"},
		"critical_failure": {"type": "string"},
		"critical_success": {"type": "string"},
		"sources": {"$ref": "#/definitions/sources"},
		"traits": {"$ref": "#/definitions/traits"},
		"links": {
			"type": "array",
			"items": {"$ref": "#/definitions/link"},
			"additionalItems": false
		},
		"schema_version": {"enum": [1.1]},
		"license": {"$ref": "#/definitions/license"}
	},
	"required": ["name", "type", "game-id", "game-obj", "sources"],
	"additionalProperties": false
}
