{
    "name": "At-Will Spells",
    "type": "ability",
    "text": "The monster can cast its at-will spells any number of times without using up spell slots.",
    "ability_type": "universal_monster_ability",
    "aonid": 4,
    "game-obj": "MonsterAbilities",
    "sources": [
        {
            "type": "source",
            "name": "Bestiary",
            "link": {
                "type": "link",
                "name": "Bestiary pg. 342",
                "alt": "Bestiary pg. 342",
                "game-obj": "Sources",
                "aonid": 2
            },
            "page": 342
        }
    ],
    "game-id": "6a105686111202ea0461d8516e246f37",
    "schema_version": 1.1
}