{
    "name": "Knockdown",
    "type": "ability",
    "text": "**Requirements** The monster\u2019s last action was a success with a Strike that lists Knockdown in its damage entry. **Effect** The monster knocks the target prone.",
    "ability_type": "universal_monster_ability",
    "aonid": 20,
    "game-obj": "MonsterAbilities",
    "action": {
        "type": "stat_block_section",
        "subtype": "action",
        "name": "One Action"
    },
    "sources": [
        {
            "type": "source",
            "name": "Bestiary",
            "link": {
                "type": "link",
                "name": "Bestiary pg. 343",
                "alt": "Bestiary pg. 343",
                "game-obj": "Sources",
                "aonid": 2
            },
            "page": 343
        }
    ],
    "requirement": "The monster\u2019s last action was a success with a Strike that lists Knockdown in its damage entry.",
    "effect": "The monster knocks the target prone.",
    "game-id": "0d950737e6e40c2cda6b2d9fe34b3270",
    "schema_version": 1.1
}